{
  "schema_version": 1,
  "id": "phase1_player_engine_flame",
  "family": "player_engine_flame",
  "approval_status": "candidate",
  "gameplay_identity": "Two restrained rear thrust plumes whose four-frame rhythm communicates movement.",
  "current_owner": [
    "scripts/presentation/vehicle_combat_renderer.gd"
  ],
  "native_size": [
    64,
    64
  ],
  "rendered_diameter": 64,
  "silhouette_requirement": "Two paired plumes stay separate from the chassis and from each other.",
  "orientation_cue": "The plumes extend south from two fixed north-facing engine nozzles.",
  "semantic_parts": [
    "core",
    "outer_flame"
  ],
  "pivot": [
    32,
    32
  ],
  "anchors": {
    "left_nozzle": [
      25,
      55
    ],
    "right_nozzle": [
      38,
      55
    ]
  },
  "directions": 1,
  "states": [
    "frame_0",
    "frame_1",
    "frame_2",
    "frame_3"
  ],
  "allowed_palette_roles": [
    "player_energy",
    "neutral_highlight"
  ],
  "references": [
    {
      "id": "game_assault_android_cactus",
      "study": "Read owner, role, and orientation at dense top-down combat scale."
    },
    {
      "id": "cc0_kenney_pixel_shmup",
      "study": "Study economical whole-cell silhouettes and modular construction."
    }
  ],
  "avoid_rules": [
    "No gradient, antialiasing, texture noise, lighting simulation, or baked glow.",
    "Do not derive gameplay collision, timing, or range from candidate pixels."
  ],
  "production_method": "direct_pixel",
  "collision_reference": "Candidate presentation follows existing gameplay-owned geometry for player_engine_flame.",
  "runtime_group": "player",
  "review_backgrounds": [
    "space_void",
    "deck_base",
    "neutral_highlight"
  ],
  "density_tier": "all"
}