{
  "schema_version": 1,
  "id": "phase1_player_chassis",
  "family": "player_chassis",
  "approval_status": "candidate",
  "gameplay_identity": "Player-owned interceptor candidate whose facing remains the primary combat anchor.",
  "current_owner": [
    "scripts/presentation/vehicle_combat_visual_library.gd",
    "scripts/presentation/vehicle_combat_renderer.gd"
  ],
  "native_size": [
    64,
    64
  ],
  "rendered_diameter": 64,
  "silhouette_requirement": "Pointed nose, paired wings, and separated rear engine line read before color.",
  "orientation_cue": "The pointed nose and centered muzzle define the forward direction.",
  "semantic_parts": [
    "body",
    "left_wing",
    "right_wing",
    "cockpit",
    "armor"
  ],
  "pivot": [
    32,
    32
  ],
  "anchors": {
    "muzzle": [
      32,
      8
    ],
    "right_engine": [
      39,
      56
    ],
    "left_engine": [
      25,
      56
    ]
  },
  "directions": 4,
  "states": [
    "normal"
  ],
  "allowed_palette_roles": [
    "structure_recess",
    "deck_shadow",
    "player_reward",
    "player_energy",
    "neutral_highlight"
  ],
  "references": [
    {
      "id": "game_assault_android_cactus",
      "study": "Read owner, role, and orientation at dense top-down combat scale."
    },
    {
      "id": "cc0_kenney_pixel_shmup",
      "study": "Study economical whole-cell silhouettes and modular construction."
    }
  ],
  "avoid_rules": [
    "No gradient, antialiasing, texture noise, lighting simulation, or baked glow.",
    "Do not derive gameplay collision, timing, or range from candidate pixels."
  ],
  "production_method": "imagegen_assisted",
  "collision_reference": "Candidate presentation follows existing gameplay-owned geometry for player_chassis.",
  "runtime_group": "player",
  "review_backgrounds": [
    "space_void",
    "deck_base",
    "neutral_highlight"
  ],
  "density_tier": "all"
}