{
  "schema_version": 1,
  "id": "player_engine_flame",
  "family": "player_engine_flame",
  "approval_status": "approved",
  "gameplay_identity": "A separate engine plume anchored to installed rear thrusters.",
  "current_owner": [
    "scripts/presentation/vehicle_combat_renderer.gd"
  ],
  "native_size": [
    64,
    64
  ],
  "rendered_diameter": 64,
  "silhouette_requirement": "One broad outer plume and one narrow bright core read as propulsion.",
  "orientation_cue": "The plume extends away from the mount and opposite movement facing.",
  "semantic_parts": [
    "core",
    "outer_flame"
  ],
  "pivot": [
    32,
    32
  ],
  "anchors": {
    "mount": [
      32,
      50
    ]
  },
  "directions": 16,
  "states": [
    "idle",
    "thrust"
  ],
  "allowed_palette_roles": [
    "player_energy",
    "neutral_highlight"
  ],
  "references": [
    {
      "id": "game_assault_android_cactus",
      "study": "Preserve role and orientation at dense top-down combat scale."
    },
    {
      "id": "cc0_kenney_pixel_shmup",
      "study": "Preserve economical whole-cell silhouettes and modular construction."
    }
  ],
  "avoid_rules": [
    "No gradients, antialiasing, texture noise, lighting simulation, or baked glow.",
    "Do not derive collision, attack timing, or navigation from pixel alpha."
  ],
  "production_method": "direct_pixel",
  "collision_reference": "Existing gameplay-owned geometry for player_engine_flame.",
  "runtime_group": "player",
  "review_backgrounds": [
    "space_void",
    "deck_base",
    "neutral_highlight"
  ],
  "density_tier": "all"
}
