{
  "schema_version": 1,
  "id": "hostile_thermal_projectile_proof",
  "family": "hostile_projectile_affinities",
  "approval_status": "proof",
  "gameplay_identity": "Enemy-owned thermal heavy shot with a readable leading edge, dangerous core, and trailing wake.",
  "current_owner": [
    "scripts/presentation/vehicle_combat_renderer.gd",
    "scripts/presentation/vehicle_combat_visual_library.gd",
    "scripts/combat/vehicle_projectile_store.gd"
  ],
  "native_size": [32, 32],
  "rendered_diameter": 24,
  "silhouette_requirement": "Leading head must remain distinct from the wake and may not imply a safe area smaller than collision.",
  "orientation_cue": "The compact bright head points toward travel while the tapered wake trails behind.",
  "semantic_parts": ["head", "core", "affinity_edge", "wake"],
  "pivot": [21, 16],
  "anchors": {
    "leading_edge": [27, 16],
    "wake_origin": [14, 16]
  },
  "directions": 4,
  "states": ["flight"],
  "allowed_palette_roles": [
    "blocker_edge",
    "neutral_highlight",
    "ordinary_threat",
    "thermal"
  ],
  "references": [
    {
      "id": "game_synthetik_legion_rising",
      "study": "Study projectile direction and ownership at combat scale."
    },
    {
      "id": "game_enter_the_gungeon",
      "study": "Study compact hostile-projectile readability without surface detail."
    }
  ],
  "avoid_rules": [
    "No soft glow, antialiasing, gradient trail, or subpixel rotation.",
    "Do not encode damage or collision radius with an invisible halo."
  ],
  "production_method": "direct_pixel",
  "collision_reference": "scripts/combat/vehicle_projectile_store.gd",
  "runtime_group": "hostile_projectiles",
  "review_backgrounds": ["space_void", "deck_base", "neutral_highlight"],
  "density_tier": "hard_peak"
}
