{
  "schema_version": 1,
  "id": "phase1_mobile_enemy_shooter",
  "family": "mobile_enemy_set",
  "approval_status": "candidate",
  "gameplay_identity": "shooter mobile-enemy candidate with a role-specific attack startup.",
  "current_owner": [
    "scripts/enemies/vehicle_enemy_archetypes.gd",
    "scripts/presentation/vehicle_combat_visual_library.gd"
  ],
  "native_size": [
    32,
    32
  ],
  "rendered_diameter": 32,
  "silhouette_requirement": "The role remains distinct in black silhouette and does not depend on color.",
  "orientation_cue": "Forward contact tool or weapon and rear mobility blocks define travel direction.",
  "semantic_parts": [
    "body",
    "role_accent",
    "weapon_or_tool",
    "mobility"
  ],
  "pivot": [
    16,
    16
  ],
  "anchors": {
    "muzzle": [
      30,
      16
    ],
    "rear": [
      7,
      16
    ]
  },
  "directions": 4,
  "states": [
    "attack_startup",
    "move"
  ],
  "allowed_palette_roles": [
    "structure_recess",
    "deck_base",
    "blocker_top",
    "neutral_highlight",
    "ordinary_threat"
  ],
  "references": [
    {
      "id": "game_assault_android_cactus",
      "study": "Read owner, role, and orientation at dense top-down combat scale."
    },
    {
      "id": "cc0_kenney_pixel_shmup",
      "study": "Study economical whole-cell silhouettes and modular construction."
    }
  ],
  "avoid_rules": [
    "No gradient, antialiasing, texture noise, lighting simulation, or baked glow.",
    "Do not derive gameplay collision, timing, or range from candidate pixels."
  ],
  "production_method": "imagegen_assisted",
  "collision_reference": "Candidate presentation follows existing gameplay-owned geometry for mobile_enemy_set.",
  "runtime_group": "mobile_enemies",
  "review_backgrounds": [
    "space_void",
    "deck_base",
    "neutral_highlight"
  ],
  "density_tier": "all"
}