{
  "schema_version": 1,
  "id": "player_primary_projectiles",
  "family": "player_primary_projectiles",
  "approval_status": "approved",
  "gameplay_identity": "Player standard ammunition and a visibly heavier opening Breach round.",
  "current_owner": [
    "scripts/player/vehicle_primary_weapon.gd",
    "scripts/combat/vehicle_projectile_state.gd",
    "scripts/presentation/vehicle_combat_visual_library.gd"
  ],
  "native_size": [
    32,
    32
  ],
  "rendered_diameter": 32,
  "silhouette_requirement": "Standard fire is compact; Breach fire has a larger collar and forward mass.",
  "orientation_cue": "A leading head and connected rear wake make travel direction unambiguous.",
  "semantic_parts": [
    "body",
    "core",
    "wake",
    "breach_collar"
  ],
  "pivot": [
    16,
    16
  ],
  "anchors": {
    "head": [
      25,
      16
    ],
    "rear": [
      7,
      16
    ]
  },
  "directions": 8,
  "states": [
    "flight_0",
    "flight_1"
  ],
  "allowed_palette_roles": [
    "structure_recess",
    "player_reward",
    "player_energy",
    "neutral_highlight"
  ],
  "references": [
    {
      "id": "game_assault_android_cactus",
      "study": "Preserve role and orientation at dense top-down combat scale."
    },
    {
      "id": "cc0_kenney_pixel_shmup",
      "study": "Preserve economical whole-cell silhouettes and modular construction."
    }
  ],
  "avoid_rules": [
    "No gradients, antialiasing, texture noise, lighting simulation, or baked glow.",
    "Do not derive collision, attack timing, or navigation from pixel alpha."
  ],
  "production_method": "imagegen_assisted",
  "collision_reference": "Existing gameplay-owned geometry for player_primary_projectiles.",
  "runtime_group": "player_projectiles",
  "review_backgrounds": [
    "space_void",
    "deck_base",
    "neutral_highlight"
  ],
  "density_tier": "all"
}
